{
  "schema": "echelon.execution-envelope/v2",
  "operationId": "op-7f3c",
  "correlationId": "corr-19a2",
  "timestamp": "2026-09-26T14:00:00Z",
  "actor": {
    "kind": "automation",
    "id": "github/github-actions",
    "provider": "github",
    "model": "unknown",
    "runtime": "github-actions"
  },
  "execution": "EXE-dokimos.gh-run-9001"
}
