{
  "schema": "echelon.execution-envelope/v2",
  "operationId": "op-7f3c",
  "correlationId": "corr-19a2",
  "timestamp": "2026-09-26T14:00:00Z",
  "actor": {
    "kind": "agent",
    "id": "openai/codex",
    "provider": "openai",
    "model": "gpt-5-codex",
    "runtime": "codex"
  },
  "execution": "EXE-20260926T140000000Z-e5e5e5e5",
  "provenance": {
    "contract": "praxis.provenance-record",
    "version": "1.0.0",
    "subject": "aegis:fault/F-17",
    "contributions": {
      "EXE-20260926T120000000Z-d4d4d4d4": {
        "operations": [
          "created"
        ],
        "at": "2026-09-26T12:00:00.000Z",
        "actor": {
          "kind": "agent",
          "id": "google/gemini-cli",
          "provider": "google",
          "model": "gemini-2.5-pro",
          "runtime": "gemini-cli"
        },
        "reason": "Security review",
        "evidence": [
          "dokimos:snapshot/app:abc123"
        ]
      }
    },
    "derivedFrom": [
      "git:commit/abc123",
      "dokimos:snapshot/app:abc123"
    ],
    "sources": {
      "git:commit/abc123": {
        "contract": "praxis.provenance-record",
        "version": "1.0.0",
        "subject": "git:commit/abc123",
        "contributions": {
          "EXE-20260926T100000000Z-c3c3c3c3": {
            "operations": [
              "created"
            ],
            "at": "2026-09-26T10:00:00.000Z",
            "actor": {
              "kind": "agent",
              "id": "anthropic/claude-code",
              "provider": "anthropic",
              "model": "unknown",
              "runtime": "claude-code"
            },
            "reason": "Implement RQ-APP-2026-A007",
            "evidence": [
              "git:commit/abc123"
            ]
          }
        },
        "derivedFrom": [
          "praxis:RQ-APP-2026-A007"
        ],
        "sources": {
          "praxis:RQ-APP-2026-A007": {
            "contract": "praxis.provenance-record",
            "version": "1.0.0",
            "subject": "praxis:RQ-APP-2026-A007",
            "contributions": {
              "EXE-20260926T080000000Z-a1a1a1a1": {
                "operations": [
                  "created"
                ],
                "at": "2026-09-26T08:00:00.000Z",
                "actor": {
                  "kind": "agent",
                  "id": "anthropic/claude-code",
                  "provider": "anthropic",
                  "model": "unknown",
                  "runtime": "claude-code"
                },
                "reason": "Captured from customer interview"
              },
              "EXE-20260926T090000000Z-b2b2b2b2": {
                "operations": [
                  "modified"
                ],
                "at": "2026-09-26T09:00:00.000Z",
                "actor": {
                  "kind": "agent",
                  "id": "openai/codex",
                  "provider": "openai",
                  "model": "gpt-5-codex",
                  "runtime": "codex"
                },
                "reason": "Tighten acceptance criteria"
              }
            }
          }
        }
      },
      "dokimos:snapshot/app:abc123": {
        "contract": "praxis.provenance-record",
        "version": "1.0.0",
        "subject": "dokimos:snapshot/app:abc123",
        "contributions": {
          "EXE-dokimos.gh-run-9001": {
            "operations": [
              "created"
            ],
            "at": "2026-09-26T11:00:00.000Z",
            "actor": {
              "kind": "automation",
              "id": "github/github-actions",
              "provider": "github",
              "model": "unknown",
              "runtime": "github-actions"
            },
            "reason": "Measured by CI; measurement actor is not the code author"
          }
        },
        "derivedFrom": [
          "git:commit/abc123"
        ],
        "sources": {
          "git:commit/abc123": {
            "contract": "praxis.provenance-record",
            "version": "1.0.0",
            "subject": "git:commit/abc123",
            "contributions": {
              "EXE-20260926T100000000Z-c3c3c3c3": {
                "operations": [
                  "created"
                ],
                "at": "2026-09-26T10:00:00.000Z",
                "actor": {
                  "kind": "agent",
                  "id": "anthropic/claude-code",
                  "provider": "anthropic",
                  "model": "unknown",
                  "runtime": "claude-code"
                },
                "reason": "Implement RQ-APP-2026-A007",
                "evidence": [
                  "git:commit/abc123"
                ]
              }
            },
            "derivedFrom": [
              "praxis:RQ-APP-2026-A007"
            ],
            "sources": {
              "praxis:RQ-APP-2026-A007": {
                "contract": "praxis.provenance-record",
                "version": "1.0.0",
                "subject": "praxis:RQ-APP-2026-A007",
                "contributions": {
                  "EXE-20260926T080000000Z-a1a1a1a1": {
                    "operations": [
                      "created"
                    ],
                    "at": "2026-09-26T08:00:00.000Z",
                    "actor": {
                      "kind": "agent",
                      "id": "anthropic/claude-code",
                      "provider": "anthropic",
                      "model": "unknown",
                      "runtime": "claude-code"
                    },
                    "reason": "Captured from customer interview"
                  },
                  "EXE-20260926T090000000Z-b2b2b2b2": {
                    "operations": [
                      "modified"
                    ],
                    "at": "2026-09-26T09:00:00.000Z",
                    "actor": {
                      "kind": "agent",
                      "id": "openai/codex",
                      "provider": "openai",
                      "model": "gpt-5-codex",
                      "runtime": "codex"
                    },
                    "reason": "Tighten acceptance criteria"
                  }
                }
              }
            }
          }
        }
      }
    }
  }
}
