{
  "schema": "echelon.execution-envelope/v2",
  "operationId": "op-followup-0005",
  "correlationId": "corr-2026-09-26-05",
  "timestamp": "2026-09-26T09:40:00.000Z",
  "actor": { "kind": "automation", "id": "github/github-actions", "provider": "github", "model": "unknown", "runtime": "github-actions" },
  "execution": "EXT-github-actions.run-777-1",
  "provenance": {
    "schema": "praxis.provenance/2",
    "history": [{ "who": "someone", "what": "a shape this registry version does not interpret" }]
  }
}
