{
  "schema": "echelon.execution-envelope/v2",
  "operationId": "op-7f3c",
  "correlationId": "corr-19a2",
  "timestamp": "2026-09-26T14:00:00Z",
  "actor": {
    "kind": "agent",
    "id": "openai/codex",
    "provider": "openai",
    "model": "gpt-5-codex",
    "runtime": "codex"
  },
  "execution": "EXE-20260926T140000000Z-e5e5e5e5",
  "runIdentifiers": {
    "sessionId": "s-1"
  },
  "source": {
    "repository": "kemiller2002/app",
    "branch": "main",
    "commit": "abc123"
  }
}
